{
  "$schema": "../../../schema/review.schema.json",
  "version": 1,
  "project": {
    "name": "Pocket Tasks",
    "title": "UX review",
    "date": "2026-10-18",
    "links": [],
    "theme": {
      "accent": "#2f5d50"
    }
  },
  "platforms": [
    {
      "id": "mobile",
      "label": "Mobile",
      "shape": "portrait"
    },
    {
      "id": "desktop",
      "label": "Desktop",
      "shape": "auto"
    }
  ],
  "severities": [
    {
      "id": "P0",
      "label": "P0",
      "color": "#c62828",
      "description": "Critical: broken flow, data loss or blocker"
    },
    {
      "id": "P1",
      "label": "P1",
      "color": "#b45f00",
      "description": "Major: clearly wrong or painful, has a workaround"
    },
    {
      "id": "P2",
      "label": "P2",
      "color": "#2f7d5b",
      "description": "Minor: polish and consistency"
    }
  ],
  "areas": [],
  "issues": [
    {
      "id": "m-1",
      "platform": "mobile",
      "area": "Add task",
      "severity": "P0",
      "title": "Add task button is cut off on phones",
      "details": "The form is a fixed **560px** wide, so on a 412px phone the button runs off the right edge.",
      "where": "app/style.css:10",
      "top": true,
      "screenshots": [
        "screenshots/issues/audit-mobile.png"
      ],
      "status": "fixed"
    },
    {
      "id": "m-2",
      "platform": "mobile",
      "area": "Task list",
      "severity": "P1",
      "title": "Completed tasks are almost invisible",
      "details": "Light grey on white, far below a 4.5:1 contrast ratio.",
      "where": "app/style.css:19",
      "status": "fixed",
      "note": "Contrast 4.6:1."
    },
    {
      "id": "d-1",
      "platform": "desktop",
      "area": "Task list",
      "severity": "P1",
      "title": "Completed tasks are almost invisible",
      "details": "Same colour as on mobile.",
      "where": "app/style.css:19",
      "screenshots": [
        "screenshots/issues/audit-desktop.png"
      ],
      "status": "fixed",
      "note": "Contrast 4.6:1."
    },
    {
      "id": "d-2",
      "platform": "desktop",
      "area": "Task list",
      "severity": "P2",
      "title": "Task list stretches across the whole screen",
      "details": "At 1440px each task sits far from its delete button, which makes rows hard to scan.",
      "status": "fixed"
    },
    {
      "id": "m-3",
      "platform": "mobile",
      "area": "Task list",
      "severity": "P2",
      "title": "Delete is a tiny × with no confirmation",
      "details": "The tap target is about 20px and one tap removes the task for good.",
      "status": "open"
    },
    {
      "id": "d-3",
      "platform": "desktop",
      "area": "Task list",
      "severity": "P2",
      "title": "Tasks are gone after a reload",
      "status": "notabug",
      "note": "By design: Pocket Tasks keeps tasks in memory only."
    }
  ],
  "fixes": [
    {
      "title": "Add form fits on phones",
      "summary": "The form takes the available width (up to 560px) and the input shrinks, so **Add task** stays on screen.",
      "files": [
        "app/style.css"
      ],
      "platforms": {
        "mobile": {
          "pairs": [
            {
              "before": "screenshots/fix1/add-mobile-before.png",
              "after": "screenshots/fix1/add-mobile-after.png"
            }
          ]
        }
      },
      "issues": [
        "m-1"
      ],
      "number": 1,
      "id": "fix-1",
      "date": "2026-10-18"
    },
    {
      "title": "Completed tasks are readable",
      "summary": "Done tasks use `#6b7a80` (4.6:1 on white) and keep the strike-through, so they read as done without disappearing.",
      "files": [
        "app/style.css"
      ],
      "platforms": {
        "mobile": {
          "description": "412x915",
          "pairs": [
            {
              "before": {
                "src": "screenshots/fix2/list-mobile-before.png",
                "caption": "Done tasks are barely visible."
              },
              "after": {
                "src": "screenshots/fix2/list-mobile-after.png",
                "caption": "Muted but readable."
              }
            }
          ]
        },
        "desktop": {
          "description": "1440x900",
          "pairs": [
            {
              "before": {
                "src": "screenshots/fix2/list-desktop-before.png"
              },
              "after": {
                "src": "screenshots/fix2/list-desktop-after.png"
              }
            }
          ]
        }
      },
      "number": 2,
      "id": "fix-2",
      "date": "2026-10-18",
      "issues": [
        "m-2",
        "d-1"
      ]
    },
    {
      "title": "Centred reading column on desktop",
      "summary": "The page is capped at 680px and centred, so each task stays close to its delete button.",
      "files": [
        "app/style.css"
      ],
      "platforms": {
        "desktop": {
          "pairs": [
            {
              "before": "screenshots/fix3/list-desktop-before.png",
              "after": "screenshots/fix3/list-desktop-after.png"
            }
          ]
        }
      },
      "issues": [
        "d-2"
      ],
      "number": 3,
      "id": "fix-3",
      "date": "2026-10-18"
    }
  ],
  "plan": [
    {
      "id": "next",
      "title": "Next",
      "items": [
        {
          "id": "next-delete",
          "title": "Bigger delete button with an undo toast",
          "severity": "P2",
          "effort": "S",
          "files": "app/app.js, app/style.css",
          "issues": [
            "m-3"
          ],
          "status": "todo"
        }
      ]
    }
  ]
}
